commit	val_nrmse2	val_r2	status	description
7e36f64	0.373605	0.626395	keep	frozen-latent-16 base (full-budget verified); ~ties PCA-16 0.3726
b7ebc05	0.381396	0.618604	discard	PCA pre-reduction D->512 before AE; fewer params but lost nonlinear structure, worse
999c7b3	0.455270	0.544730	discard	Single hidden [512], no noise, dropout 0.02, no WD, batch 128, LR 5e-3; overfit badly
b4f25c4	0.368815	0.631185	keep	Larger batch 128 + linearly scaled LR 4e-3; beats PCA-16 (0.3726)
a7f9381	0.367737	0.632263	keep	Remove weight decay (1e-5→0); dropout+noise already regularize
6cd2bf0	0.383057	0.616943	discard	Reduce dropout 0.1→0.05; less regularization hurt, noise alone insufficient
a3a282d	0.358846	0.641154	keep	Tied decoder weights (transposed encoder); halves params ~5.3M→~2.7M, reduces overfitting
9bd27fe	0.361562	0.638438	discard	Reduce noise 0.3→0.15; tied weights already regularize — slightly worse
37a2e10	0.357228	0.642772	keep	PCA pre-reduction D→256 + single hidden [128]; 35K params, 3531 epochs, new best
c0552a3	0.357326	0.642674	discard	Widen hidden [128]->[256]; 71K params, 3530 epochs, slightly worse (no benefit from extra capacity)
0c8a5ef	0.357160	0.642840	keep	Remove denoising noise (0.3→0.0) in PCA space; tied weights+PCA pre-reduction regularize sufficiently
c473091	0.358573	0.641427	discard	Reduce dropout 0.1→0.02; tied weights+PCA already regularize — slightly worse
5cd79ab	0.357096	0.642904	keep	Orthogonal init for encoder linear layers; tied-weight W^T W ≈ I preserves norms
3127fae	0.363066	0.636934	discard	Mixup augmentation (alpha=0.2): interpolate training pairs; hurt — off-manifold targets worse
1c1cbbf	0.356887	0.643113	keep	Reduce PCA pre-reduction 256→128; fewer params, more epochs, new best
d8b7458	0.357190	0.642810	discard	Gradient clipping max_norm=1.0; slightly worse — gradients already stable
f25696d	0.356638	0.643362	keep	EMA (decay=0.998) replaces SWA; smoothed weights from epoch 0, new best
c9da0c5	0.359074	0.640926	discard	Reduce PCA pre-reduction 128→64; too few input dims, lost nonlinear structure
6dbf776	0.356250	0.643750	keep	Schedule tuning: warmup 5%→10%, LR floor 1e-5→1e-6; better basin + finer convergence
3adb3bb	0.356934	0.643066	discard	Dropout annealing (0.1→0.0 linearly over training); slightly worse — constant dropout better here
a6515f6	0.358873	0.641127	discard	Two-layer funnel encoder [128, 64]; depth hurts at dim-16 too — worse than single [128]
dbd3e46	0.357086	0.642914	discard	Untie bottleneck decoder layer (independent 16→128 weight); +2K params, slightly worse — tied constraint helps regularize
d5e035c	0.356398	0.643602	discard	Larger batch (128→256) + linearly scaled LR (4e-3→8e-3); slightly worse — batch 128 already optimal here
5194a5d	0.492650	0.507350	discard	PCA component whitening (unit-variance normalization before AE); model wasted capacity on low-variance components, much worse
b49c438	0.356998	0.643002	discard	Bottleneck BatchNorm on 16-dim latent code; slight regularization overhead, worse than best
pending	0.356945	0.643055	discard	Soft orthogonality reg (1e-3) on encoder weights; small overhead, slightly worse
pending	0.358171	0.641829	discard	Widen hidden [128]->[256] with PCA_PRE_DIM=128; 38K params, extra capacity doesn't help at dim-16
pending	0.794265	0.205735	discard	Gradient centralization on weight matrices; severely disrupted tied-weight training dynamics
pending	0.359327	0.640673	discard	Pre-bottleneck residual (h+x in enc, h+r in dec); disrupted BN scale + tied-weight dynamics, worse
pending	0.358222	0.641778	discard	EMA decay 0.998→0.999 (wider averaging window); included too-early params, worse
pending	0.356683	0.643317	discard	Latent-skip projection (zero-init Linear 16→128 added to first decoder hidden); marginal overhead, slightly worse
pending	0.356941	0.643059	discard	Latent noise injection (std=0.1) on 16-dim code during training; noise regularization hurt reconstruction
pending	0.356376	0.643624	discard	EMA decay annealing 0.99→0.999 over training; addressed early-param issue but still slightly worse than constant 0.998
pending	0.357944	0.642056	discard	Learnable per-component scaling (log_scale param on PCA dims); extra freedom didn't help, slightly worse
pending	0.362541	0.637459	discard	SAM (Sharpness-Aware Minimization) rho=0.05; flatter minima but halved epochs (1500 vs ~3500), worse
pending	0.357373	0.642627	discard	Asymmetric dropout (enc=0.1, dec=0.0); removing decoder dropout slightly worse — decoder dropout helps regularize tied weights
pending	0.357420	0.642580	discard	Latent decorrelation reg (lambda=0.005 off-diag correlation penalty); slight overhead, no benefit — latent dims already sufficiently decorrelated
pending	0.356487	0.643513	discard	1-cycle LR schedule (30% cosine ramp-up, div=25); different optimization trajectory but slightly worse than linear warmup+cosine
pending	0.356347	0.643653	discard	Mish activation (x*tanh(softplus(x))) instead of SiLU; smoother but no improvement over SiLU
pending	0.357249	0.642751	discard	NAdam optimizer (Nesterov-accelerated Adam) instead of AdamW; Nesterov look-ahead didn't help, slightly worse
pending	0.357503	0.642497	discard	Learnable Swish activation (x*sigmoid(beta*x), beta trained from 1.0); learned beta diverged from SiLU, slightly worse
pending	0.364724	0.635276	discard	LayerNorm on 16-dim latent code (per-sample normalization); bottleneck normalization hurts — too restrictive on code representation
pending	0.357375	0.642625	discard	Lookahead optimizer (k=6, alpha=0.5) wrapping AdamW; slow-weight sync disrupted fine optimization trajectory, slightly worse
pending	0.356787	0.643213	discard	Gradient noise injection (scale=0.01, noise_std=lr*scale); added exploration but EMA already smooths trajectory, slightly worse
pending	0.357432	0.642568	discard	AMSGrad=True in AdamW; step size monotonicity constraint slightly worse — default Adam adaptive step sizes sufficient
pending	0.356470	0.643530	discard	Lower Adam beta1 0.9→0.8 (less momentum, more responsive); EMA already smooths trajectory, lower momentum didn't help
pending	0.359074	0.640926	discard	Narrow hidden [128]->[96]; 14.5K params, 3606 epochs — capacity loss outweighed epoch gain, worse
pending	0.358046	0.641954	discard	Widen hidden [128]->[192]; 28.9K params, 3408 epochs — extra capacity didn't improve, slightly worse
pending	0.354971	0.645029	keep	BN cumulative moving avg for EMA stat refresh (reset_running_stats + momentum=None); more accurate BN stats, new best
pending	0.356306	0.643694	discard	Progressive dropout annealing (0.05→0.15 over training); increasing regularization didn't help — constant 0.1 better
pending	0.355589	0.644411	discard	Post-activation BN (Linear→SiLU→BN→Dropout instead of Linear→BN→SiLU→Dropout); slightly worse — pre-activation BN better for tied weights
pending	0.355428	0.644572	discard	Disable dropout during BN stat refresh (eval-mode Dropout while BN trains); minor mismatch, no improvement
pending	0.355611	0.644389	discard	Increase LR 4e-3→5e-3; slightly too aggressive, EMA smoothing insufficient to compensate
pending	0.355196	0.644804	discard	Per-batch LR scheduling (update LR every batch instead of per-epoch); marginal overhead, no improvement — per-epoch granularity already sufficient
pending	0.356040	0.643960	discard	PCA_PRE_DIM 128→160; more input variance but extra low-variance dims didn't help, 23K params, 3413 epochs
pending	0.355779	0.644221	discard	Exponential LR decay instead of cosine annealing; log-linear decay spends more time at mid-LR, slightly worse
pending	0.355964	0.644036	discard	Decoder code MLP (Linear 16→16 + SiLU before tied decoder); added nonlinear code unfolding, +272 params, slightly worse
pending	0.355915	0.644085	discard	Cosine warm restarts (2 cycles) instead of single cosine decay; LR oscillation disrupted EMA convergence, slightly worse
pending	0.357178	0.642822	discard	Smaller batch size (128→64); noisier gradients and fewer epochs outweighed extra optimizer steps, worse
pending	0.355594	0.644406	discard	Learned per-latent-dim scaling (16 log_scale params, zero-init exp scaling after encoder); optimizer already handles scale via weight matrix, no benefit
pending	0.359524	0.640476	discard	Input component dropout (p=0.03) as denoising regularization; zeroing random PCA dims hurt reconstruction, worse than no corruption
pending	0.357964	0.642036	discard	Ghost BatchNorm (virtual_batch_size=32); noisier BN stats during training hurt more than they regularized, worse
pending	0.355610	0.644390	discard	Denoising noise annealing (std 0.1→0 linearly over training); even annealed noise hurts — tied weights+PCA+EMA already regularize sufficiently
pending	0.355060	0.644940	discard	Latent code L2 regularization (CODE_REG=1e-4 on z.pow(2).mean()); soft bottleneck constraint slightly worse — codes already well-constrained by tied weights
pending	0.356380	0.643620	discard	Curriculum learning (easy-first by PCA-16 residual norm, 40%→100% over 85% of training); structured ordering hurt — random sampling provides better gradient diversity
pending	0.355429	0.644571	discard	Focal MSE loss (gamma=0.5): weight samples by MSE^gamma to emphasize hard examples; slight overhead, didn't improve — uniform weighting already optimal
pending	0.356392	0.643608	discard	Full-dataset BN stat refresh (single forward pass vs mini-batch cumulative); exact population stats slightly worse — mini-batch cumulative averaging provides beneficial smoothing
pending	0.355263	0.644737	discard	Increase warmup 10%→15%; longer exploration phase before cosine decay, slightly worse — 10% warmup already optimal
pending	0.354605	0.645395	keep	Adam beta2=0.9999 (up from 0.999); more stable second-moment estimate for smoother late-training convergence, new best
pending	0.355142	0.644858	discard	Reduce dropout 0.1→0.05; model has many regularizers (tied weights, PCA pre, EMA, BN) but less dropout still slightly worse
pending	0.355609	0.644391	discard	Adam beta1=0.95 (higher momentum); too much momentum smoothed out useful gradient signal, slightly worse
pending	0.354826	0.645174	discard	SWA (flat averaging last 20%) replacing EMA (decay=0.998); equal-weight averaging underperformed exponential recency bias, slightly worse
pending	0.355572	0.644428	discard	Reduce LR 4e-3→3.5e-3; lower LR too slow for tied-weight regime even with beta2=0.9999, slightly worse
pending	0.356124	0.643876	discard	Gaussian dropout (multiplicative noise x*(1+0.1*N(0,1))) replacing binary dropout; smoother noise but weaker regularization than hard zeros, slightly worse
pending	0.357540	0.642460	discard	PCA-error-weighted MSE loss (upweight samples with high PCA-16 residual energy); biased loss toward hard samples hurt uniform-metric evaluation, worse
pending	0.372715	0.627285	discard	Linear decoder (no BN/Act/Dropout in decoder, purely linear tied-weight reconstruction); decoder collapsed to PCA-level — nonlinear decoder IS essential

pending	0.355909	0.644091	discard	GrokFast gradient filtering (alpha=0.98, lambda=1.0): amplify slow gradient components; gradient amplification disrupted fine convergence, slightly worse
pending	0.355463	0.644537	discard	Weight perturbation (std=1e-3) on linear weights: grad at θ+ε, update at θ for flat minima; noisy gradients slightly worse than clean, no benefit over EMA smoothing
pending	0.355212	0.644788	discard	Power cosine LR schedule (exponent=1.5): slower initial decay, sharper late decay; higher LR longer didn't help, slightly worse
pending	0.353424	0.646576	keep	Asymmetric dropout (enc=0.0, dec=0.1): clean encoder codes, decoder-only dropout regularises tied-weight reconstruction; new best
pending	0.353932	0.646068	discard	Increase decoder dropout 0.1→0.15; too much decoder regularization slightly hurt reconstruction, 0.1 already optimal
pending	0.353998	0.646002	discard	Residual code MLP (zero-init Linear 16→16→16 with SiLU) before decoder; +544 params, nonlinear code correction didn't improve — latent codes already well-optimized by tied weights
pending	0.353574	0.646426	discard	Increase LR 4e-3→5e-3 (re-test with beta2=0.9999 + asymmetric dropout); slightly worse — 4e-3 still optimal even with improved optimizer/regularization
pending	0.355290	0.644710	discard	ELU activation instead of SiLU; ELU's exponential negative saturation worse than SiLU's smooth non-monotonic shape for tied-weight AE
pending	0.354347	0.645653	discard	Cosine warmup (smooth join with cosine decay) instead of linear warmup; slightly worse — linear warmup's higher avg LR during ramp is better
pending	0.353580	0.646420	discard	LR 4e-3→4.5e-3 (interpolate between 4e-3 best and 5e-3 near-miss); slightly worse — 4e-3 remains optimal
pending	0.354290	0.645710	discard	EMA decay 0.998→0.995 (shorter averaging window); worse — 0.998 window still optimal, shorter window too noisy
pending	0.354296	0.645704	discard	Cosine similarity auxiliary loss (alpha=0.05) added to MSE; directional regularization didn't help — MSE already captures angular accuracy sufficiently
pending	0.356571	0.643429	discard	Code-conditioned decoder gate (FiLM-style sigmoid(Linear(z,128)) after decoder SiLU); multiplicative modulation added overhead without improving reconstruction, worse
pending	0.355170	0.644830	discard	Widen hidden [128]->[160]; ~24K params, extra capacity with current regularization still didn't help — fewer epochs outweighed expressivity gain
pending	0.353608	0.646392	discard	Higher LR (4e-3→4.5e-3) + stronger EMA (0.998→0.999); higher LR explores faster but stronger smoothing didn't compensate enough, slightly worse
pending	0.354538	0.645462	discard	Step dropout annealing (dec 0.1→0.0 at 85% progress); fine-tuning without dropout noise didn't help — constant dropout better throughout
pending	0.356379	0.643621	discard	Spectral normalization on encoder linear layers (Lipschitz regularization on weight spectrum); too restrictive for small tied-weight model, constrained expressivity, worse
pending	0.353999	0.646001	discard	Trapezoidal LR schedule (10% warmup + 10% flat at peak + 80% cosine decay); extra time at peak LR didn't help — less cosine decay time hurt fine convergence, slightly worse
pending	0.353671	0.646329	discard	PCA_PRE_DIM 128→112; fewer params (~17K) + more epochs but lost PCA components 113-128 carry useful nonlinear signal, slightly worse
pending	0.353379	0.646621	keep	Mini warm restart at 85% (peak=15% of LR): gentle late-training exploration escape local minimum, new best
pending	0.353370	0.646630	keep	Two mini warm restarts (70% at 10% peak + 85% at 15% peak): dual exploration escapes, new best
pending	0.354170	0.645830	discard	Weight normalization on encoder linears (decouple magnitude/direction); decoupled optimization didn't help tied-weight regime, slightly worse
pending	0.353378	0.646622	discard	Reset EMA at warm restart points (fresh average post-restart); stale pre-restart weights not the issue, slightly worse
pending	0.358767	0.641233	discard	Log-cosh loss (2x scaled) instead of MSE; robust loss downweighted large residuals that MSE metric cares most about, worse
pending	0.357179	0.642821	discard	Latent-to-output linear projection (zero-init Linear 16→128 added to decoder output); direct linear recon path from code didn't help at dim-16, worse
pending	0.354850	0.645150	discard	Per-layer LR (bottleneck 1.5x base): higher LR for 128→16 projection to explore projection space; overshot optimal projection, slightly worse
pending	0.354446	0.645554	discard	Three mini warm restarts (55%@10%, 70%@13%, 85%@17%); third restart shortened main training phase too much, worse than dual restart
pending	0.354478	0.645522	discard	Bottleneck-only weight decay (WD=1e-4 on Linear 128→16 only); targeted WD on subspace projection didn't help — tied weights already regularize bottleneck sufficiently
pending	0.354579	0.645421	discard	Adam beta2=0.99999 (up from 0.9999); second-moment estimates became too stale, couldn't adapt to gradient changes during warm restarts, slightly worse
pending	0.353408	0.646592	discard	Adaptive EMA decay near restarts (0.99 for 2% window after each restart vs 0.998 elsewhere); softer than full reset but still slightly worse — constant EMA decay optimal
pending	0.353399	0.646601	discard	Reset Adam optimizer state at warm restart points (clear momentum + second moments); fresh optimizer stats didn't help — stale moments not the bottleneck, slightly worse
pending	0.353492	0.646508	discard	Shift warm restarts later (70%/85%→75%/90%): more main cosine phase time; slightly worse — 70%/85% timing already optimal
pending	0.353756	0.646244	discard	Stochastic 85% data subsampling per epoch (implicit regularization + more epochs); fewer samples per epoch hurt more than extra epochs helped
pending	0.354454	0.645546	discard	Per-batch EMA updates (decay^(1/N_batches) per step instead of per-epoch); finer tracking added overhead without improving averaging quality, slightly worse
pending	0.353970	0.646030	discard	Post-EMA fine-tuning (3% budget, LR=1e-5): polish EMA weights to nearby loss minimum; fine-tuning degraded EMA smoothing benefit, slightly worse
pending	0.353784	0.646216	discard	Third ultra-gentle warm restart at 95% (peak=5% of LR); extra restart shortened 85-100% phase without benefit, slightly worse
pending	0.354427	0.645573	discard	Two hidden layers [128,128] (36K params, 2564 epochs); extra depth didn't compensate for fewer epochs, capacity not the bottleneck
pending	0.353845	0.646155	discard	AMP (automatic mixed precision) training; GradScaler/autocast overhead reduced epochs 3500→2599 for this tiny model, fp16 didn't help
pending	0.353501	0.646499	discard	LR 4e-3→4.5e-3 + partial Adam momentum reset at warm restarts (zero exp_avg, keep exp_avg_sq); higher LR still slightly worse even with cleaner restarts
pending	0.353402	0.646598	discard	Three warm restarts at 70%/82%/92% with escalating peaks (10%/12%/15% of LR); preserved 70% main phase but shorter cycles didn't improve over dual restarts
pending	0.353876	0.646124	discard	Partial Adam momentum reset (zero exp_avg, keep exp_avg_sq) at warm restart points; stale momentum not the bottleneck at LR=4e-3, slightly worse
pending	0.356216	0.643784	discard	Remove decoder BatchNorm (asymmetric normalization: BN in encoder only); decoder BN still important for tied-weight reconstruction, worse despite more epochs (4166 vs ~3500)
pending	0.354898	0.645102	discard	Dual EMA (0.998+0.9995, weights 0.6/0.4): blend short-term and long-term smoothed weights; long-term EMA included too many early suboptimal weights, worse
pending	0.353699	0.646301	discard	Cycle consistency loss (alpha=0.01, every 4th batch): MSE(encode(decode(z)),z.detach()) idempotency reg; 3326 epochs (~5% fewer), regularization didn't offset epoch loss
pending	0.353546	0.646454	discard	SE attention block (reduction=16) in encoder before bottleneck; +2.2K params (21.5K total), 2781 epochs — learned channel gating didn't offset fewer epochs
pending	0.354512	0.645488	discard	Soft Adam momentum decay (0.5x exp_avg) at warm restart points; halved momentum lost useful directional signal, worse than both full reset (0.353399) and no reset (0.353370)
pending	0.354488	0.645512	discard	Parameter perturbation (0.5% of param std) at warm restart points; noise too disruptive, model couldn't fully recover to optimal basin